
****** Vivado v2018.3 (64-bit)
  **** SW Build 2405991 on Thu Dec  6 23:36:41 MST 2018
  **** IP Build 2404404 on Fri Dec  7 01:43:56 MST 2018
    ** Copyright 1986-2018 Xilinx, Inc. All Rights Reserved.

source /misc/scratch/zwei1/reports_Jan12/raw_designs/opencores/arithmetic/ecg_submodules/f3m_neg/run_tcl.tcl
# set outputDir /misc/scratch/zwei1/reports_Jan12/raw_designs/opencores/arithmetic/ecg_submodules/f3m_neg
# file mkdir $outputDir
# read_verilog -quiet /misc/scratch/zwei1/raw_data/raw_designs/opencores/arithmetic/ecg_submodules/f3m_neg.v
# synth_design -part xc7z020clg484-3 -top f3m_neg -mode out_of_context
Command: synth_design -part xc7z020clg484-3 -top f3m_neg -mode out_of_context
Starting synth_design
Attempting to get a license for feature 'Synthesis' and/or device 'xc7z020'
INFO: [Common 17-349] Got license for feature 'Synthesis' and/or device 'xc7z020'
INFO: Launching helper process for spawning children vivado processes
INFO: Helper process launched with PID 242179 
---------------------------------------------------------------------------------
Starting Synthesize : Time (s): cpu = 00:00:02 ; elapsed = 00:00:04 . Memory (MB): peak = 1500.539 ; gain = 26.895 ; free physical = 253171 ; free virtual = 314154
---------------------------------------------------------------------------------
INFO: [Synth 8-6157] synthesizing module 'f3m_neg' [/misc/scratch/zwei1/raw_data/raw_designs/opencores/arithmetic/ecg_submodules/f3m_neg.v:10]
INFO: [Synth 8-6155] done synthesizing module 'f3m_neg' (1#1) [/misc/scratch/zwei1/raw_data/raw_designs/opencores/arithmetic/ecg_submodules/f3m_neg.v:10]
WARNING: [Synth 8-3330] design f3m_neg has an empty top module
---------------------------------------------------------------------------------
Finished Synthesize : Time (s): cpu = 00:00:03 ; elapsed = 00:00:05 . Memory (MB): peak = 1546.305 ; gain = 72.660 ; free physical = 253062 ; free virtual = 314047
---------------------------------------------------------------------------------
---------------------------------------------------------------------------------
Finished Constraint Validation : Time (s): cpu = 00:00:03 ; elapsed = 00:00:05 . Memory (MB): peak = 1546.305 ; gain = 72.660 ; free physical = 253062 ; free virtual = 314046
---------------------------------------------------------------------------------
---------------------------------------------------------------------------------
Start Loading Part and Timing Information
---------------------------------------------------------------------------------
Loading part: xc7z020clg484-3
---------------------------------------------------------------------------------
Finished Loading Part and Timing Information : Time (s): cpu = 00:00:03 ; elapsed = 00:00:05 . Memory (MB): peak = 1554.305 ; gain = 80.660 ; free physical = 253062 ; free virtual = 314046
---------------------------------------------------------------------------------
---------------------------------------------------------------------------------
INFO: [Device 21-403] Loading part xc7z020clg484-3
Finished RTL Optimization Phase 2 : Time (s): cpu = 00:00:03 ; elapsed = 00:00:05 . Memory (MB): peak = 1554.312 ; gain = 80.668 ; free physical = 253048 ; free virtual = 314033
---------------------------------------------------------------------------------

Report RTL Partitions: 
+-+--------------+------------+----------+
| |RTL Partition |Replication |Instances |
+-+--------------+------------+----------+
+-+--------------+------------+----------+
No constraint files found.
---------------------------------------------------------------------------------
Start RTL Component Statistics 
---------------------------------------------------------------------------------
Detailed RTL Component Info : 
---------------------------------------------------------------------------------
Finished RTL Component Statistics 
---------------------------------------------------------------------------------
---------------------------------------------------------------------------------
Start RTL Hierarchical Component Statistics 
---------------------------------------------------------------------------------
Hierarchical RTL Component report 
---------------------------------------------------------------------------------
Finished RTL Hierarchical Component Statistics
---------------------------------------------------------------------------------
---------------------------------------------------------------------------------
Start Part Resource Summary
---------------------------------------------------------------------------------
Part Resources:
DSPs: 220 (col length:60)
BRAMs: 280 (col length: RAMB18 60 RAMB36 30)
---------------------------------------------------------------------------------
Finished Part Resource Summary
---------------------------------------------------------------------------------
No constraint files found.
---------------------------------------------------------------------------------
Start Cross Boundary and Area Optimization
---------------------------------------------------------------------------------
Warning: Parallel synthesis criteria is not met 
WARNING: [Synth 8-3330] design f3m_neg has an empty top module
---------------------------------------------------------------------------------
Finished Cross Boundary and Area Optimization : Time (s): cpu = 00:00:06 ; elapsed = 00:00:09 . Memory (MB): peak = 1663.895 ; gain = 190.250 ; free physical = 252470 ; free virtual = 313456
---------------------------------------------------------------------------------

Report RTL Partitions: 
+-+--------------+------------+----------+
| |RTL Partition |Replication |Instances |
+-+--------------+------------+----------+
+-+--------------+------------+----------+
No constraint files found.
---------------------------------------------------------------------------------
Start Timing Optimization
---------------------------------------------------------------------------------
---------------------------------------------------------------------------------
Finished Timing Optimization : Time (s): cpu = 00:00:06 ; elapsed = 00:00:10 . Memory (MB): peak = 1663.895 ; gain = 190.250 ; free physical = 252459 ; free virtual = 313446
---------------------------------------------------------------------------------

Report RTL Partitions: 
+-+--------------+------------+----------+
| |RTL Partition |Replication |Instances |
+-+--------------+------------+----------+
+-+--------------+------------+----------+
---------------------------------------------------------------------------------
Start Technology Mapping
---------------------------------------------------------------------------------
---------------------------------------------------------------------------------
Finished Technology Mapping : Time (s): cpu = 00:00:06 ; elapsed = 00:00:10 . Memory (MB): peak = 1672.902 ; gain = 199.258 ; free physical = 252448 ; free virtual = 313434
---------------------------------------------------------------------------------

Report RTL Partitions: 
+-+--------------+------------+----------+
| |RTL Partition |Replication |Instances |
+-+--------------+------------+----------+
+-+--------------+------------+----------+
---------------------------------------------------------------------------------
Start IO Insertion
---------------------------------------------------------------------------------
---------------------------------------------------------------------------------
Start Flattening Before IO Insertion
---------------------------------------------------------------------------------
---------------------------------------------------------------------------------
Finished Flattening Before IO Insertion
---------------------------------------------------------------------------------
---------------------------------------------------------------------------------
Start Final Netlist Cleanup
---------------------------------------------------------------------------------
---------------------------------------------------------------------------------
Finished Final Netlist Cleanup
---------------------------------------------------------------------------------
---------------------------------------------------------------------------------
Finished IO Insertion : Time (s): cpu = 00:00:06 ; elapsed = 00:00:10 . Memory (MB): peak = 1672.906 ; gain = 199.262 ; free physical = 252347 ; free virtual = 313270
---------------------------------------------------------------------------------

Report Check Netlist: 
+------+------------------+-------+---------+-------+------------------+
|      |Item              |Errors |Warnings |Status |Description       |
+------+------------------+-------+---------+-------+------------------+
|1     |multi_driven_nets |      0|        0|Passed |Multi driven nets |
+------+------------------+-------+---------+-------+------------------+
---------------------------------------------------------------------------------
Start Renaming Generated Instances
---------------------------------------------------------------------------------
---------------------------------------------------------------------------------
Finished Renaming Generated Instances : Time (s): cpu = 00:00:06 ; elapsed = 00:00:10 . Memory (MB): peak = 1672.906 ; gain = 199.262 ; free physical = 252346 ; free virtual = 313269
---------------------------------------------------------------------------------

Report RTL Partitions: 
+-+--------------+------------+----------+
| |RTL Partition |Replication |Instances |
+-+--------------+------------+----------+
+-+--------------+------------+----------+
---------------------------------------------------------------------------------
Start Rebuilding User Hierarchy
---------------------------------------------------------------------------------
---------------------------------------------------------------------------------
Finished Rebuilding User Hierarchy : Time (s): cpu = 00:00:06 ; elapsed = 00:00:10 . Memory (MB): peak = 1672.906 ; gain = 199.262 ; free physical = 252344 ; free virtual = 313267
---------------------------------------------------------------------------------
---------------------------------------------------------------------------------
Start Renaming Generated Ports
---------------------------------------------------------------------------------
---------------------------------------------------------------------------------
Finished Renaming Generated Ports : Time (s): cpu = 00:00:06 ; elapsed = 00:00:10 . Memory (MB): peak = 1672.906 ; gain = 199.262 ; free physical = 252342 ; free virtual = 313266
---------------------------------------------------------------------------------
---------------------------------------------------------------------------------
Start Handling Custom Attributes
---------------------------------------------------------------------------------
---------------------------------------------------------------------------------
Finished Handling Custom Attributes : Time (s): cpu = 00:00:06 ; elapsed = 00:00:10 . Memory (MB): peak = 1672.906 ; gain = 199.262 ; free physical = 252340 ; free virtual = 313264
---------------------------------------------------------------------------------
---------------------------------------------------------------------------------
Start Renaming Generated Nets
---------------------------------------------------------------------------------
---------------------------------------------------------------------------------
Finished Renaming Generated Nets : Time (s): cpu = 00:00:06 ; elapsed = 00:00:10 . Memory (MB): peak = 1672.906 ; gain = 199.262 ; free physical = 252342 ; free virtual = 313267
---------------------------------------------------------------------------------
---------------------------------------------------------------------------------
Start Writing Synthesis Report
---------------------------------------------------------------------------------

Report BlackBoxes: 
+-+--------------+----------+
| |BlackBox name |Instances |
+-+--------------+----------+
+-+--------------+----------+

Report Cell Usage: 
+-+-----+------+
| |Cell |Count |
+-+-----+------+
+-+-----+------+

Report Instance Areas: 
+------+---------+-------+------+
|      |Instance |Module |Cells |
+------+---------+-------+------+
|1     |top      |       |     0|
+------+---------+-------+------+
---------------------------------------------------------------------------------
Finished Writing Synthesis Report : Time (s): cpu = 00:00:06 ; elapsed = 00:00:10 . Memory (MB): peak = 1672.906 ; gain = 199.262 ; free physical = 252341 ; free virtual = 313265
---------------------------------------------------------------------------------
Synthesis finished with 0 errors, 0 critical warnings and 2 warnings.
Synthesis Optimization Runtime : Time (s): cpu = 00:00:06 ; elapsed = 00:00:10 . Memory (MB): peak = 1672.906 ; gain = 199.262 ; free physical = 252336 ; free virtual = 313261
Synthesis Optimization Complete : Time (s): cpu = 00:00:06 ; elapsed = 00:00:10 . Memory (MB): peak = 1672.910 ; gain = 199.262 ; free physical = 252341 ; free virtual = 313267
INFO: [Project 1-571] Translating synthesized netlist
INFO: [Project 1-570] Preparing netlist for logic optimization
INFO: [Opt 31-138] Pushed 0 inverter(s) to 0 load pin(s).
Netlist sorting complete. Time (s): cpu = 00:00:00 ; elapsed = 00:00:00 . Memory (MB): peak = 1770.082 ; gain = 0.000 ; free physical = 252259 ; free virtual = 313164
INFO: [Project 1-111] Unisim Transformation Summary:
No Unisim elements were transformed.

INFO: [Common 17-83] Releasing license: Synthesis
9 Infos, 2 Warnings, 0 Critical Warnings and 0 Errors encountered.
synth_design completed successfully
synth_design: Time (s): cpu = 00:00:09 ; elapsed = 00:00:13 . Memory (MB): peak = 1770.082 ; gain = 296.535 ; free physical = 252301 ; free virtual = 313206
# set_units -power mW
INFO: [Timing 38-35] Done setting XDC timing constraints.
WARNING: [Power 33-232] No user defined clocks were found in the design!
Resolution: Please specify clocks using create_clock/create_generated_clock for sequential elements. For pure combinatorial circuits, please specify a virtual clock, otherwise the vectorless estimation might be inaccurate
set_units: Time (s): cpu = 00:00:08 ; elapsed = 00:00:08 . Memory (MB): peak = 2245.707 ; gain = 475.625 ; free physical = 251629 ; free virtual = 312542
# write_checkpoint -force $outputDir/post_synth
Netlist sorting complete. Time (s): cpu = 00:00:00 ; elapsed = 00:00:00 . Memory (MB): peak = 2245.707 ; gain = 0.000 ; free physical = 251628 ; free virtual = 312541
INFO: [Timing 38-480] Writing timing data to binary archive.
Netlist sorting complete. Time (s): cpu = 00:00:00 ; elapsed = 00:00:00 . Memory (MB): peak = 2269.719 ; gain = 0.000 ; free physical = 251620 ; free virtual = 312532
INFO: [Common 17-1381] The checkpoint '/misc/scratch/zwei1/reports_Jan12/raw_designs/opencores/arithmetic/ecg_submodules/f3m_neg/post_synth.dcp' has been generated.
# report_timing_summary -file $outputDir/post_synth_timing_summary.rpt
INFO: [Timing 38-91] UpdateTimingParams: Speed grade: -3, Delay Type: min_max.
INFO: [Timing 38-191] Multithreading enabled for timing update using a maximum of 8 CPUs
# report_power -file $outputDir/post_synth_power.rpt
Command: report_power -file /misc/scratch/zwei1/reports_Jan12/raw_designs/opencores/arithmetic/ecg_submodules/f3m_neg/post_synth_power.rpt
Running Vector-less Activity Propagation...

Finished Running Vector-less Activity Propagation
0 Infos, 0 Warnings, 0 Critical Warnings and 0 Errors encountered.
report_power completed successfully
# opt_design
Command: opt_design
Attempting to get a license for feature 'Implementation' and/or device 'xc7z020'
INFO: [Common 17-349] Got license for feature 'Implementation' and/or device 'xc7z020'
Running DRC as a precondition to command opt_design

Starting DRC Task
INFO: [DRC 23-27] Running DRC with 8 threads
INFO: [Project 1-461] DRC finished with 0 Errors
INFO: [Project 1-462] Please refer to the DRC report (report_drc) for more information.

Time (s): cpu = 00:00:00.13 ; elapsed = 00:00:00.43 . Memory (MB): peak = 2309.734 ; gain = 0.000 ; free physical = 251585 ; free virtual = 312498

Starting Cache Timing Information Task
Ending Cache Timing Information Task | Checksum: 11100e24

Time (s): cpu = 00:00:00.01 ; elapsed = 00:00:00 . Memory (MB): peak = 2309.734 ; gain = 0.000 ; free physical = 251585 ; free virtual = 312498

Starting Logic Optimization Task

Phase 1 Retarget
INFO: [Opt 31-138] Pushed 0 inverter(s) to 0 load pin(s).
INFO: [Opt 31-49] Retargeted 0 cell(s).
Phase 1 Retarget | Checksum: 11100e24

Time (s): cpu = 00:00:00.01 ; elapsed = 00:00:00.02 . Memory (MB): peak = 2330.719 ; gain = 0.004 ; free physical = 251414 ; free virtual = 312327
INFO: [Opt 31-389] Phase Retarget created 0 cells and removed 0 cells

Phase 2 Constant propagation
INFO: [Opt 31-138] Pushed 0 inverter(s) to 0 load pin(s).
Phase 2 Constant propagation | Checksum: 11100e24

Time (s): cpu = 00:00:00.01 ; elapsed = 00:00:00.03 . Memory (MB): peak = 2330.719 ; gain = 0.004 ; free physical = 251414 ; free virtual = 312327
INFO: [Opt 31-389] Phase Constant propagation created 0 cells and removed 0 cells

Phase 3 Sweep
Phase 3 Sweep | Checksum: 11100e24

Time (s): cpu = 00:00:00.01 ; elapsed = 00:00:00.03 . Memory (MB): peak = 2330.719 ; gain = 0.004 ; free physical = 251413 ; free virtual = 312326
INFO: [Opt 31-389] Phase Sweep created 0 cells and removed 0 cells

Phase 4 BUFG optimization
Phase 4 BUFG optimization | Checksum: 11100e24

Time (s): cpu = 00:00:00.01 ; elapsed = 00:00:00.03 . Memory (MB): peak = 2330.719 ; gain = 0.004 ; free physical = 251413 ; free virtual = 312326
INFO: [Opt 31-662] Phase BUFG optimization created 0 cells of which 0 are BUFGs and removed 0 cells.

Phase 5 Shift Register Optimization
Phase 5 Shift Register Optimization | Checksum: 11100e24

Time (s): cpu = 00:00:00.04 ; elapsed = 00:00:00.05 . Memory (MB): peak = 2330.719 ; gain = 0.004 ; free physical = 251406 ; free virtual = 312319
INFO: [Opt 31-389] Phase Shift Register Optimization created 0 cells and removed 0 cells

Phase 6 Post Processing Netlist
Phase 6 Post Processing Netlist | Checksum: 11100e24

Time (s): cpu = 00:00:00.04 ; elapsed = 00:00:00.05 . Memory (MB): peak = 2330.719 ; gain = 0.004 ; free physical = 251406 ; free virtual = 312319
INFO: [Opt 31-389] Phase Post Processing Netlist created 0 cells and removed 0 cells
Opt_design Change Summary
=========================


-------------------------------------------------------------------------------------------------------------------------
|  Phase                        |  #Cells created  |  #Cells Removed  |  #Constrained objects preventing optimizations  |
-------------------------------------------------------------------------------------------------------------------------
|  Retarget                     |               0  |               0  |                                              0  |
|  Constant propagation         |               0  |               0  |                                              0  |
|  Sweep                        |               0  |               0  |                                              0  |
|  BUFG optimization            |               0  |               0  |                                              0  |
|  Shift Register Optimization  |               0  |               0  |                                              0  |
|  Post Processing Netlist      |               0  |               0  |                                              0  |
-------------------------------------------------------------------------------------------------------------------------



Starting Connectivity Check Task

Time (s): cpu = 00:00:00 ; elapsed = 00:00:00 . Memory (MB): peak = 2330.719 ; gain = 0.000 ; free physical = 251405 ; free virtual = 312318
Ending Logic Optimization Task | Checksum: 11100e24

Time (s): cpu = 00:00:00.04 ; elapsed = 00:00:00.06 . Memory (MB): peak = 2330.719 ; gain = 0.004 ; free physical = 251405 ; free virtual = 312318

Starting Power Optimization Task
INFO: [Pwropt 34-132] Skipping clock gating for clocks with a period < 2.00 ns.
Ending Power Optimization Task | Checksum: 11100e24

Time (s): cpu = 00:00:00.01 ; elapsed = 00:00:00.03 . Memory (MB): peak = 2330.719 ; gain = 0.000 ; free physical = 251379 ; free virtual = 312292

Starting Final Cleanup Task
Ending Final Cleanup Task | Checksum: 11100e24

Time (s): cpu = 00:00:00 ; elapsed = 00:00:00 . Memory (MB): peak = 2330.719 ; gain = 0.000 ; free physical = 251373 ; free virtual = 312286

Starting Netlist Obfuscation Task
Netlist sorting complete. Time (s): cpu = 00:00:00 ; elapsed = 00:00:00 . Memory (MB): peak = 2330.719 ; gain = 0.000 ; free physical = 251369 ; free virtual = 312282
Ending Netlist Obfuscation Task | Checksum: 11100e24

Time (s): cpu = 00:00:00 ; elapsed = 00:00:00 . Memory (MB): peak = 2330.719 ; gain = 0.000 ; free physical = 251367 ; free virtual = 312280
INFO: [Common 17-83] Releasing license: Implementation
15 Infos, 0 Warnings, 0 Critical Warnings and 0 Errors encountered.
opt_design completed successfully
# power_opt_design
Command: power_opt_design
Attempting to get a license for feature 'Implementation' and/or device 'xc7z020'
INFO: [Common 17-349] Got license for feature 'Implementation' and/or device 'xc7z020'
INFO: [Timing 38-35] Done setting XDC timing constraints.
Begin power optimizations | Checksum: 11100e24
WARNING: [Pwropt 34-141] Param pwropt.runOnPwroptedDesign is set. Skipped checking if power_opt_design has been performed earlier.
INFO: [Pwropt 34-50] Optimizing power for module f3m_neg ...
INFO: [Pwropt 34-207] Design is in pre-place state. Running in pre-place mode.
INFO: [Physopt 32-619] Estimated Timing Summary | WNS=0.000 | TNS=0.000 |
Pre-processing: Time (s): cpu = 00:00:00.01 ; elapsed = 00:00:00.01 . Memory (MB): peak = 2402.730 ; gain = 8.012 ; free physical = 251317 ; free virtual = 312230
INFO: [Pwropt 34-9] Applying IDT optimizations ...
PSMgr Creation: Time (s): cpu = 00:00:00.05 ; elapsed = 00:00:00.14 . Memory (MB): peak = 2402.730 ; gain = 8.012 ; free physical = 251309 ; free virtual = 312221
IDT: Time (s): cpu = 00:00:00 ; elapsed = 00:00:00 . Memory (MB): peak = 2402.730 ; gain = 0.000 ; free physical = 251309 ; free virtual = 312221
INFO: [Pwropt 34-10] Applying ODC optimizations ...
INFO: [Pwropt 34-215] Skipped ODC enables for 0 nets in BRAM flops in bus-based analysis.
INFO: [Pwropt 34-214] Skipped ODC enables for 0 nets in BRAM address flops in bus-based analysis.
ODC: Time (s): cpu = 00:00:00.01 ; elapsed = 00:00:00 . Memory (MB): peak = 2498.773 ; gain = 96.043 ; free physical = 251308 ; free virtual = 312221
Power optimization passes: Time (s): cpu = 00:00:00.07 ; elapsed = 00:00:00.14 . Memory (MB): peak = 2498.773 ; gain = 104.055 ; free physical = 251309 ; free virtual = 312222
WARNING: [Power 33-232] No user defined clocks were found in the design!
Resolution: Please specify clocks using create_clock/create_generated_clock for sequential elements. For pure combinatorial circuits, please specify a virtual clock, otherwise the vectorless estimation might be inaccurate
Running Vector-less Activity Propagation...

Finished Running Vector-less Activity Propagation

INFO: [Pwropt 34-77] Creating clock enable groups ...
INFO: [Pwropt 34-96] Including small groups for filtering based on enable probabilities.
 Done
Grouping enables: Time (s): cpu = 00:00:00 ; elapsed = 00:00:00 . Memory (MB): peak = 2506.777 ; gain = 0.000 ; free physical = 251314 ; free virtual = 312227


Starting PowerOpt Patch Enables Task
INFO: [Pwropt 34-26] Patching clock gating enable signals for design f3m_neg ...
INFO: [Pwropt 34-162] WRITE_MODE attribute of 0 BRAM(s) out of a total of 0 has been updated to save power. Run report_power_opt to get a complete listing of the BRAMs updated.
INFO: [Pwropt 34-201] Structural ODC has moved 0 WE to EN ports

Number of Slice Registers augmented: 0 newly gated: 0 Total: 0
Number of SRLs augmented: 0  newly gated: 0 Total: 0
Number of BRAM Ports augmented: 0 newly gated: 0 Total Ports: 0
Number of Flops added for Enable Generation: 0

Flops dropped: 0/0 RAMS dropped: 0/0 Clusters dropped: 0/0 Enables dropped: 0
Patching clock gating enables finished successfully.
Ending PowerOpt Patch Enables Task | Checksum: 11100e24

Time (s): cpu = 00:00:00.01 ; elapsed = 00:00:00.01 . Memory (MB): peak = 2506.777 ; gain = 0.000 ; free physical = 251322 ; free virtual = 312235
INFO: [Pwropt 34-30] Power optimization finished successfully.
End power optimizations | Checksum: 11100e24
Power optimization: Time (s): cpu = 00:00:00.25 ; elapsed = 00:00:00.21 . Memory (MB): peak = 2506.777 ; gain = 176.059 ; free physical = 251332 ; free virtual = 312245
INFO: [Pwropt 34-198] Malloced memory gain at end of power optimization: -1608824 bytes

Starting Logic Optimization Task

Phase 1 Retarget
INFO: [Opt 31-138] Pushed 0 inverter(s) to 0 load pin(s).
INFO: [Opt 31-49] Retargeted 0 cell(s).
Phase 1 Retarget | Checksum: 11100e24

Time (s): cpu = 00:00:00.01 ; elapsed = 00:00:00.02 . Memory (MB): peak = 2506.777 ; gain = 0.000 ; free physical = 251332 ; free virtual = 312245
INFO: [Opt 31-389] Phase Retarget created 0 cells and removed 0 cells

Phase 2 BUFG optimization
Phase 2 BUFG optimization | Checksum: 11100e24

Time (s): cpu = 00:00:00.01 ; elapsed = 00:00:00.02 . Memory (MB): peak = 2506.777 ; gain = 0.000 ; free physical = 251332 ; free virtual = 312245
INFO: [Opt 31-662] Phase BUFG optimization created 0 cells of which 0 are BUFGs and removed 0 cells.

Phase 3 Remap
Phase 3 Remap | Checksum: 11100e24

Time (s): cpu = 00:00:00.01 ; elapsed = 00:00:00.02 . Memory (MB): peak = 2506.777 ; gain = 0.000 ; free physical = 251332 ; free virtual = 312245
INFO: [Opt 31-389] Phase Remap created 0 cells and removed 0 cells

Phase 4 Post Processing Netlist
Phase 4 Post Processing Netlist | Checksum: 11100e24

Time (s): cpu = 00:00:00.01 ; elapsed = 00:00:00.02 . Memory (MB): peak = 2506.777 ; gain = 0.000 ; free physical = 251332 ; free virtual = 312245
INFO: [Opt 31-389] Phase Post Processing Netlist created 0 cells and removed 0 cells
Opt_design Change Summary
=========================


---------------------------------------------------------------------------------------------------------------------
|  Phase                    |  #Cells created  |  #Cells Removed  |  #Constrained objects preventing optimizations  |
---------------------------------------------------------------------------------------------------------------------
|  Retarget                 |               0  |               0  |                                              0  |
|  BUFG optimization        |               0  |               0  |                                              0  |
|  Remap                    |               0  |               0  |                                              0  |
|  Post Processing Netlist  |               0  |               0  |                                              0  |
---------------------------------------------------------------------------------------------------------------------


Ending Logic Optimization Task | Checksum: 11100e24

Time (s): cpu = 00:00:00.01 ; elapsed = 00:00:00.02 . Memory (MB): peak = 2506.777 ; gain = 0.000 ; free physical = 251331 ; free virtual = 312244

Starting Netlist Obfuscation Task
Netlist sorting complete. Time (s): cpu = 00:00:00 ; elapsed = 00:00:00 . Memory (MB): peak = 2506.777 ; gain = 0.000 ; free physical = 251331 ; free virtual = 312244
Ending Netlist Obfuscation Task | Checksum: 11100e24

Time (s): cpu = 00:00:00 ; elapsed = 00:00:00 . Memory (MB): peak = 2506.777 ; gain = 0.000 ; free physical = 251331 ; free virtual = 312244
INFO: [Common 17-83] Releasing license: Implementation
23 Infos, 2 Warnings, 0 Critical Warnings and 0 Errors encountered.
power_opt_design completed successfully
# place_design
Command: place_design
Attempting to get a license for feature 'Implementation' and/or device 'xc7z020'
INFO: [Common 17-349] Got license for feature 'Implementation' and/or device 'xc7z020'
INFO: [DRC 23-27] Running DRC with 8 threads
INFO: [Vivado_Tcl 4-198] DRC finished with 0 Errors
INFO: [Vivado_Tcl 4-199] Please refer to the DRC report (report_drc) for more information.
Running DRC as a precondition to command place_design
INFO: [DRC 23-27] Running DRC with 8 threads
INFO: [Vivado_Tcl 4-198] DRC finished with 0 Errors
INFO: [Vivado_Tcl 4-199] Please refer to the DRC report (report_drc) for more information.

Starting Placer Task
INFO: [Place 30-611] Multithreading enabled for place_design using a maximum of 8 CPUs

Phase 1 Placer Initialization

Phase 1.1 Placer Initialization Netlist Sorting
Netlist sorting complete. Time (s): cpu = 00:00:00 ; elapsed = 00:00:00 . Memory (MB): peak = 2506.777 ; gain = 0.000 ; free physical = 251331 ; free virtual = 312244
Phase 1.1 Placer Initialization Netlist Sorting | Checksum: 00000000

Time (s): cpu = 00:00:00.01 ; elapsed = 00:00:00.02 . Memory (MB): peak = 2506.777 ; gain = 0.000 ; free physical = 251331 ; free virtual = 312244
Phase 1 Placer Initialization | Checksum: 00000000

Time (s): cpu = 00:00:00.01 ; elapsed = 00:00:00.02 . Memory (MB): peak = 2506.777 ; gain = 0.000 ; free physical = 251331 ; free virtual = 312244
Ending Placer Task | Checksum: 00000000

Time (s): cpu = 00:00:00.01 ; elapsed = 00:00:00.02 . Memory (MB): peak = 2506.777 ; gain = 0.000 ; free physical = 251331 ; free virtual = 312244
INFO: [Common 17-83] Releasing license: Implementation
9 Infos, 0 Warnings, 0 Critical Warnings and 2 Errors encountered.
place_design failed
INFO: [Common 17-206] Exiting Vivado at Tue Jan 11 21:30:04 2022...
